[
  {
    "uuid": "70062d6d-aa8a-4274-808c-98adf30a6445",
    "link": "internal:/",
    "text": "Secondary 1",
    "parent": "",
    "weight": 0
  },
  {
    "uuid": "de9c50e1-b5fd-4522-abc7-68b52ae2b3ec",
    "link": "internal:/individuals",
    "text": "\n          Secondary 2\n  \n  ",
    "parent": "",
    "weight": 0
  }
]
