[
  {
    "uuid": "eb5fe9df-d48e-4a07-b643-25d5d32c47dc",
    "link": "internal:/",
    "text": "Footer 1",
    "parent": "",
    "weight": 0
  },
  {
    "uuid": "32fcfa8a-501a-4af2-981f-a82d4d5d3958",
    "link": "internal:/",
    "text": "Footer 2",
    "parent": "",
    "weight": 0
  },
  {
    "uuid": "54c46956-72b7-4afd-b365-164244753cb0",
    "link": "internal:/",
    "text": "Footer 21",
    "parent": "32fcfa8a-501a-4af2-981f-a82d4d5d3958",
    "weight": 0
  }
]
